{
  "repository": "NegativeNine/steamcloud",
  "sha": "0000000000000000000000000000000000000000",
  "role": "Steam operational and automation domain platform on Campfire",
  "authority": "Steam accounts, credential references/generations, sessions, runtime placement, egress, bot affinity, collection policies, Steam-specific operation catalog and effect adapters",
  "maturity": "NEW PROPOSAL / NOT IMPLEMENTED / NOT DEPLOYED",
  "findings": [
    {
      "id": "STEAMCLOUD.BLOCKER-001",
      "repository": "NegativeNine/steamcloud",
      "sha": "0000000000000000000000000000000000000000",
      "severity": "P0",
      "confidence": "INFERRED",
      "category": "production-dependency",
      "title": "SteamCloud cannot be production authority until Campfire and Ember qualify",
      "claim": "SteamCloud is a new Campfire profile and therefore inherits Campfire C1-C5 and Ember trust/durability blockers.",
      "sources": [
        {
          "path": "docs/CURRENT_STATE.md",
          "start_line": null,
          "end_line": null,
          "note": "New repository assessment"
        },
        {
          "path": "docs/DEPENDENCIES.md",
          "start_line": null,
          "end_line": null,
          "note": "Blocking dependencies"
        }
      ],
      "scenario": "The new domain is deployed with real Steam credentials or persistent sessions against reference orchestration.",
      "impact": "Lost, duplicated or cross-account operations.",
      "affected_gate": "SteamCloud S8",
      "owner_repository": "NegativeNine/steamcloud",
      "consumer_repositories": [
        "NegativeNine/autosteamfarm.com",
        "NegativeNine/steamcommunitydatabase.com"
      ],
      "reproduction": null,
      "remediation": "Develop against mock agents, but gate real account authority on signed Campfire/Ember qualification evidence.",
      "rollback_considerations": null,
      "runtime_verification_required": true,
      "possibly_changed_after_snapshot": false
    },
    {
      "id": "STEAMCLOUD.SECRET-002",
      "repository": "NegativeNine/steamcloud",
      "sha": "0000000000000000000000000000000000000000",
      "severity": "P1",
      "confidence": "INFERRED",
      "category": "credential-custody",
      "title": "Credential vault and opaque secret lease path are not implemented",
      "claim": "The proposed architecture requires Campfire/Ember to hold only references and generations; no production vault integration exists.",
      "sources": [
        {
          "path": "docs/SECURITY.md",
          "start_line": null,
          "end_line": null,
          "note": "Target credential boundary"
        }
      ],
      "scenario": "A shortcut stores refresh tokens, passwords, cookies or authenticator secrets in a run, queue or database projection.",
      "impact": "Fleet-wide credential compromise.",
      "affected_gate": "SteamCloud S2",
      "owner_repository": "NegativeNine/steamcloud",
      "consumer_repositories": [
        "NegativeNine/autosteamfarm.com"
      ],
      "reproduction": null,
      "remediation": "Implement KMS-backed envelope encryption and one-runtime short-lived secret leases with audit and revocation.",
      "rollback_considerations": null,
      "runtime_verification_required": true,
      "possibly_changed_after_snapshot": false
    },
    {
      "id": "STEAMCLOUD.AGENT-003",
      "repository": "NegativeNine/steamcloud",
      "sha": "0000000000000000000000000000000000000000",
      "severity": "P1",
      "confidence": "INFERRED",
      "category": "agent-runtime",
      "title": "External account/scraper agents and resource fencing are not implemented",
      "claim": "The package contains contracts and samples only; no deployed regional agent gateway, scheduler or egress controller exists.",
      "sources": [
        {
          "path": "docs/CURRENT_STATE.md",
          "start_line": null,
          "end_line": null,
          "note": "New repository assessment"
        },
        {
          "path": "docs/ROADMAP.md",
          "start_line": null,
          "end_line": null,
          "note": "S1-S3"
        }
      ],
      "scenario": "Two agents own one account or stale action grants execute after reassignment.",
      "impact": "Duplicate and cross-account Steam effects.",
      "affected_gate": "SteamCloud S1-S3",
      "owner_repository": "NegativeNine/steamcloud",
      "consumer_repositories": [],
      "reproduction": null,
      "remediation": "Implement authenticated agent registration, account/credential/egress resource leases and generation-fenced action settlement.",
      "rollback_considerations": null,
      "runtime_verification_required": true,
      "possibly_changed_after_snapshot": false
    }
  ],
  "commands": [
    {
      "command": "node --test",
      "status": "PASSED",
      "detail": "Generated sample package validated locally."
    },
    {
      "command": "python3 scripts/validate_repository.py",
      "status": "PASSED",
      "detail": "Generated sample package validated locally."
    }
  ],
  "limitations": [
    "Static review of the original frozen repository; no original runtime commands executed.",
    "No production secrets, databases, external services or deployment evidence were available.",
    "Generated sample code is architectural scaffolding, not a drop-in replacement."
  ]
}
